[
  {
    "evidenceId": "EVID-0001",
    "trueEventId": "EVT-CASE-01-A",
    "trueLineageId": "L1",
    "relationshipType": "primary_observation"
  },
  {
    "evidenceId": "EVID-0002",
    "trueEventId": "EVT-CASE-01-A",
    "trueLineageId": "L2",
    "relationshipType": "corroborating"
  },
  {
    "evidenceId": "EVID-0003",
    "trueEventId": "EVT-CASE-01-A",
    "trueLineageId": "L3",
    "relationshipType": "corroborating"
  },
  {
    "evidenceId": "EVID-0004",
    "trueEventId": "EVT-CASE-01-A",
    "trueLineageId": "L4",
    "relationshipType": "corroborating"
  },
  {
    "evidenceId": "EVID-0005",
    "trueEventId": "EVT-CASE-01-A",
    "trueLineageId": "L5",
    "relationshipType": "corroborating"
  },
  {
    "evidenceId": "EVID-0006",
    "trueEventId": "EVT-CASE-01-A",
    "trueLineageId": "L6",
    "relationshipType": "corroborating"
  },
  {
    "evidenceId": "EVID-0007",
    "trueEventId": "EVT-CASE-01-A",
    "trueLineageId": "L7",
    "relationshipType": "corroborating"
  },
  {
    "evidenceId": "EVID-0008",
    "trueEventId": "EVT-CASE-01-A",
    "trueLineageId": "L8",
    "relationshipType": "corroborating"
  },
  {
    "evidenceId": "EVID-0009",
    "trueEventId": "EVT-CASE-01-A",
    "trueLineageId": "L9",
    "relationshipType": "corroborating"
  },
  {
    "evidenceId": "EVID-0010",
    "trueEventId": "EVT-CASE-01-A",
    "trueLineageId": "L10",
    "relationshipType": "corroborating"
  },
  {
    "evidenceId": "EVID-0011",
    "trueEventId": "EVT-CASE-01-A",
    "trueLineageId": "L11",
    "relationshipType": "corroborating"
  },
  {
    "evidenceId": "EVID-0012",
    "trueEventId": "EVT-CASE-02-A",
    "trueLineageId": "L1",
    "relationshipType": "primary_observation"
  },
  {
    "evidenceId": "EVID-0013",
    "trueEventId": "EVT-CASE-02-A",
    "trueLineageId": "L2",
    "relationshipType": "corroborating"
  },
  {
    "evidenceId": "EVID-0014",
    "trueEventId": "EVT-CASE-02-A",
    "trueLineageId": "L3",
    "relationshipType": "corroborating"
  },
  {
    "evidenceId": "EVID-0015",
    "trueEventId": "EVT-CASE-02-A",
    "trueLineageId": "L4",
    "relationshipType": "corroborating"
  },
  {
    "evidenceId": "EVID-0016",
    "trueEventId": "EVT-CASE-02-A",
    "trueLineageId": "L5",
    "relationshipType": "corroborating"
  },
  {
    "evidenceId": "EVID-0017",
    "trueEventId": "EVT-CASE-02-A",
    "trueLineageId": "L6",
    "relationshipType": "corroborating"
  },
  {
    "evidenceId": "EVID-0018",
    "trueEventId": "EVT-CASE-02-A",
    "trueLineageId": "L7",
    "relationshipType": "corroborating"
  },
  {
    "evidenceId": "EVID-0019",
    "trueEventId": "EVT-CASE-02-A",
    "trueLineageId": "L8",
    "relationshipType": "corroborating"
  },
  {
    "evidenceId": "EVID-0020",
    "trueEventId": "EVT-CASE-02-A",
    "trueLineageId": "L9",
    "relationshipType": "corroborating"
  },
  {
    "evidenceId": "EVID-0021",
    "trueEventId": "EVT-CASE-02-A",
    "trueLineageId": "L10",
    "relationshipType": "corroborating"
  },
  {
    "evidenceId": "EVID-0022",
    "trueEventId": "EVT-CASE-02-A",
    "trueLineageId": "L11",
    "relationshipType": "corroborating"
  },
  {
    "evidenceId": "EVID-0023",
    "trueEventId": "EVT-CASE-02-A",
    "trueLineageId": "L12",
    "relationshipType": "corroborating"
  },
  {
    "evidenceId": "EVID-0024",
    "trueEventId": "EVT-CASE-03-A",
    "trueLineageId": "L1",
    "relationshipType": "primary_observation"
  },
  {
    "evidenceId": "EVID-0025",
    "trueEventId": "EVT-CASE-03-A",
    "trueLineageId": "L2",
    "relationshipType": "corroborating"
  },
  {
    "evidenceId": "EVID-0026",
    "trueEventId": "EVT-CASE-03-A",
    "trueLineageId": "L3",
    "relationshipType": "corroborating"
  },
  {
    "evidenceId": "EVID-0027",
    "trueEventId": "EVT-CASE-03-A",
    "trueLineageId": "L4",
    "relationshipType": "corroborating"
  },
  {
    "evidenceId": "EVID-0028",
    "trueEventId": "EVT-CASE-03-A",
    "trueLineageId": "L5",
    "relationshipType": "corroborating"
  },
  {
    "evidenceId": "EVID-0029",
    "trueEventId": "EVT-CASE-03-A",
    "trueLineageId": "L6",
    "relationshipType": "corroborating"
  },
  {
    "evidenceId": "EVID-0030",
    "trueEventId": "EVT-CASE-03-A",
    "trueLineageId": "L7",
    "relationshipType": "corroborating"
  },
  {
    "evidenceId": "EVID-0031",
    "trueEventId": "EVT-CASE-03-A",
    "trueLineageId": "L8",
    "relationshipType": "corroborating"
  },
  {
    "evidenceId": "EVID-0032",
    "trueEventId": "EVT-CASE-03-A",
    "trueLineageId": "L9",
    "relationshipType": "corroborating"
  },
  {
    "evidenceId": "EVID-0033",
    "trueEventId": "EVT-CASE-03-A",
    "trueLineageId": "L10",
    "relationshipType": "corroborating"
  },
  {
    "evidenceId": "EVID-0034",
    "trueEventId": "EVT-CASE-03-A",
    "trueLineageId": "L11",
    "relationshipType": "corroborating"
  },
  {
    "evidenceId": "EVID-0035",
    "trueEventId": "EVT-CASE-03-A",
    "trueLineageId": "L12",
    "relationshipType": "corroborating"
  },
  {
    "evidenceId": "EVID-0036",
    "trueEventId": "EVT-CASE-03-A",
    "trueLineageId": "L13",
    "relationshipType": "corroborating"
  },
  {
    "evidenceId": "EVID-0037",
    "trueEventId": "EVT-CASE-04-A",
    "trueLineageId": "L1",
    "relationshipType": "primary_observation"
  },
  {
    "evidenceId": "EVID-0038",
    "trueEventId": "EVT-CASE-04-A",
    "trueLineageId": "L2",
    "relationshipType": "corroborating"
  },
  {
    "evidenceId": "EVID-0039",
    "trueEventId": "EVT-CASE-04-A",
    "trueLineageId": "L3",
    "relationshipType": "corroborating"
  },
  {
    "evidenceId": "EVID-0040",
    "trueEventId": "EVT-CASE-04-A",
    "trueLineageId": "L4",
    "relationshipType": "corroborating"
  },
  {
    "evidenceId": "EVID-0041",
    "trueEventId": "EVT-CASE-04-A",
    "trueLineageId": "L5",
    "relationshipType": "corroborating"
  },
  {
    "evidenceId": "EVID-0042",
    "trueEventId": "EVT-CASE-04-A",
    "trueLineageId": "L6",
    "relationshipType": "corroborating"
  },
  {
    "evidenceId": "EVID-0043",
    "trueEventId": "EVT-CASE-04-A",
    "trueLineageId": "L7",
    "relationshipType": "corroborating"
  },
  {
    "evidenceId": "EVID-0044",
    "trueEventId": "EVT-CASE-04-A",
    "trueLineageId": "L8",
    "relationshipType": "corroborating"
  },
  {
    "evidenceId": "EVID-0045",
    "trueEventId": "EVT-CASE-04-A",
    "trueLineageId": "L9",
    "relationshipType": "corroborating"
  },
  {
    "evidenceId": "EVID-0046",
    "trueEventId": "EVT-CASE-04-A",
    "trueLineageId": "L10",
    "relationshipType": "corroborating"
  },
  {
    "evidenceId": "EVID-0047",
    "trueEventId": "EVT-CASE-05-A",
    "trueLineageId": "L1",
    "relationshipType": "primary_observation"
  },
  {
    "evidenceId": "EVID-0048",
    "trueEventId": "EVT-CASE-05-A",
    "trueLineageId": "L2",
    "relationshipType": "corroborating"
  },
  {
    "evidenceId": "EVID-0049",
    "trueEventId": "EVT-CASE-05-A",
    "trueLineageId": "L3",
    "relationshipType": "corroborating"
  },
  {
    "evidenceId": "EVID-0050",
    "trueEventId": "EVT-CASE-05-A",
    "trueLineageId": "L4",
    "relationshipType": "corroborating"
  },
  {
    "evidenceId": "EVID-0051",
    "trueEventId": "EVT-CASE-05-A",
    "trueLineageId": "L5",
    "relationshipType": "corroborating"
  },
  {
    "evidenceId": "EVID-0052",
    "trueEventId": "EVT-CASE-05-A",
    "trueLineageId": "L6",
    "relationshipType": "corroborating"
  },
  {
    "evidenceId": "EVID-0053",
    "trueEventId": "EVT-CASE-05-A",
    "trueLineageId": "L7",
    "relationshipType": "corroborating"
  },
  {
    "evidenceId": "EVID-0054",
    "trueEventId": "EVT-CASE-05-A",
    "trueLineageId": "L8",
    "relationshipType": "corroborating"
  },
  {
    "evidenceId": "EVID-0055",
    "trueEventId": "EVT-CASE-05-A",
    "trueLineageId": "L9",
    "relationshipType": "corroborating"
  },
  {
    "evidenceId": "EVID-0056",
    "trueEventId": "EVT-CASE-05-A",
    "trueLineageId": "L10",
    "relationshipType": "corroborating"
  },
  {
    "evidenceId": "EVID-0057",
    "trueEventId": "EVT-CASE-05-A",
    "trueLineageId": "L11",
    "relationshipType": "corroborating"
  },
  {
    "evidenceId": "EVID-0058",
    "trueEventId": "EVT-CASE-06-A",
    "trueLineageId": "L1",
    "relationshipType": "primary_observation"
  },
  {
    "evidenceId": "EVID-0059",
    "trueEventId": "EVT-CASE-06-A",
    "trueLineageId": "L2",
    "relationshipType": "corroborating"
  },
  {
    "evidenceId": "EVID-0060",
    "trueEventId": "EVT-CASE-06-A",
    "trueLineageId": "L3",
    "relationshipType": "corroborating"
  },
  {
    "evidenceId": "EVID-0061",
    "trueEventId": "EVT-CASE-06-A",
    "trueLineageId": "L4",
    "relationshipType": "corroborating"
  },
  {
    "evidenceId": "EVID-0062",
    "trueEventId": "EVT-CASE-06-A",
    "trueLineageId": "L5",
    "relationshipType": "corroborating"
  },
  {
    "evidenceId": "EVID-0063",
    "trueEventId": "EVT-CASE-06-A",
    "trueLineageId": "L6",
    "relationshipType": "corroborating"
  },
  {
    "evidenceId": "EVID-0064",
    "trueEventId": "EVT-CASE-06-A",
    "trueLineageId": "L7",
    "relationshipType": "corroborating"
  },
  {
    "evidenceId": "EVID-0065",
    "trueEventId": "EVT-CASE-06-A",
    "trueLineageId": "L8",
    "relationshipType": "corroborating"
  },
  {
    "evidenceId": "EVID-0066",
    "trueEventId": "EVT-CASE-06-A",
    "trueLineageId": "L9",
    "relationshipType": "corroborating"
  },
  {
    "evidenceId": "EVID-0067",
    "trueEventId": "EVT-CASE-06-A",
    "trueLineageId": "L10",
    "relationshipType": "corroborating"
  },
  {
    "evidenceId": "EVID-0068",
    "trueEventId": "EVT-CASE-06-A",
    "trueLineageId": "L11",
    "relationshipType": "corroborating"
  },
  {
    "evidenceId": "EVID-0069",
    "trueEventId": "EVT-CASE-06-A",
    "trueLineageId": "L12",
    "relationshipType": "corroborating"
  },
  {
    "evidenceId": "EVID-0070",
    "trueEventId": "EVT-CASE-07-A",